{
  "$schema": "https://json-schema.org/draft/2020-12/schema",
  "$id": "https://vibe-screen.dev/schemas/evidence/v1/phase0-stable-release.schema.json",
  "title": "Vibe Screen Phase 0 stable-release closure summary v1",
  "type": "object",
  "additionalProperties": false,
  "required": [
    "schema_version",
    "kind",
    "phase",
    "aggregate_verdict",
    "can_mark_phase0_stable_release",
    "required_gate_count",
    "closed_required_gate_count",
    "missing_required_gate_ids",
    "blocking_required_gates",
    "gate_summaries",
    "readme_guard",
    "source_guard",
    "owner_pr_guard",
    "merged_pr_guard",
    "manifest_source",
    "reasons"
  ],
  "properties": {
    "schema_version": {"const": "vibescreen.evidence/v1"},
    "kind": {"const": "phase0_stable_release_closure_summary"},
    "phase": {"const": "phase0"},
    "aggregate_verdict": {"enum": ["pass", "blocked", "fail", "insufficient"]},
    "can_mark_phase0_stable_release": {"type": "boolean"},
    "required_gate_count": {"type": "integer", "minimum": 0},
    "closed_required_gate_count": {"type": "integer", "minimum": 0},
    "missing_required_gate_ids": {"type": "array", "items": {"type": "string"}},
    "blocking_required_gates": {"type": "array", "items": {"$ref": "#/$defs/gate_summary"}},
    "gate_summaries": {"type": "array", "items": {"$ref": "#/$defs/gate_summary"}},
    "readme_guard": {
      "type": "object",
      "additionalProperties": false,
      "required": ["verdict", "missing_required_phrases", "forbidden_matches", "reasons"],
      "properties": {
        "verdict": {"enum": ["pass", "fail", "insufficient"]},
        "missing_required_phrases": {"type": "array", "items": {"type": "string"}},
        "forbidden_matches": {
          "type": "array",
          "items": {
            "type": "object",
            "additionalProperties": false,
            "required": ["pattern", "snippet"],
            "properties": {
              "pattern": {"type": "string"},
              "snippet": {"type": "string"}
            }
          }
        },
        "reasons": {"type": "array", "items": {"type": "string"}}
      }
    },
    "source_guard": {
      "type": "object",
      "additionalProperties": false,
      "required": [
        "verdict",
        "accepted_aggregate_only_successor",
        "expected_source_commit",
        "manifest_base_commit",
        "reasons"
      ],
      "properties": {
        "verdict": {"enum": ["pass", "insufficient"]},
        "accepted_aggregate_only_successor": {"type": "boolean"},
        "expected_source_commit": {"type": ["string", "null"]},
        "manifest_base_commit": {"type": ["string", "null"]},
        "reasons": {"type": "array", "items": {"type": "string"}}
      }
    },
    "owner_pr_guard": {
      "type": "object",
      "additionalProperties": false,
      "required": [
        "verdict",
        "command",
        "repository",
        "queried_at",
        "state",
        "open_pr_numbers",
        "owner_prs",
        "stale_owner_prs",
        "reasons"
      ],
      "properties": {
        "verdict": {"enum": ["pass", "insufficient"]},
        "command": {"type": ["string", "null"]},
        "repository": {"enum": ["TaoSama/vibe-screen", null]},
        "queried_at": {"type": ["string", "null"]},
        "state": {"type": ["string", "null"]},
        "open_pr_numbers": {"type": "array", "items": {"type": "integer"}},
        "owner_prs": {"type": "array", "items": {"type": "integer"}},
        "stale_owner_prs": {"type": "array", "items": {"type": "integer"}},
        "reasons": {"type": "array", "items": {"type": "string"}}
      }
    },
    "merged_pr_guard": {
      "type": "object",
      "additionalProperties": false,
      "required": [
        "verdict",
        "command",
        "repository",
        "state",
        "base",
        "range",
        "path",
        "audited_source_commit",
        "merged_pr_numbers",
        "excluded_pr_numbers",
        "non_ancestor_prs",
        "reasons"
      ],
      "properties": {
        "verdict": {"enum": ["pass", "insufficient"]},
        "command": {"type": ["string", "null"]},
        "repository": {"enum": ["TaoSama/vibe-screen", null]},
        "state": {"type": ["string", "null"]},
        "base": {"type": ["string", "null"]},
        "range": {
          "type": ["object", "null"],
          "additionalProperties": false,
          "required": ["min", "max"],
          "properties": {
            "min": {"type": "integer"},
            "max": {"type": "integer"}
          }
        },
        "path": {"type": ["string", "null"]},
        "audited_source_commit": {"type": ["string", "null"]},
        "merged_pr_numbers": {"type": "array", "items": {"type": "integer"}},
        "excluded_pr_numbers": {"type": "array", "items": {"type": "integer"}},
        "non_ancestor_prs": {"type": "array", "items": {"type": "integer"}},
        "reasons": {"type": "array", "items": {"type": "string"}}
      }
    },
    "manifest_source": {"type": "object"},
    "reasons": {"type": "array", "items": {"type": "string"}}
  },
  "$defs": {
    "gate_summary": {
      "type": "object",
      "additionalProperties": false,
      "required": [
        "id",
        "title",
        "required_for_stable_release",
        "verdict",
        "evidence_strength",
        "can_close",
        "owner_prs",
        "evidence_paths",
        "blockers",
        "issues"
      ],
      "properties": {
        "id": {"type": "string", "minLength": 1},
        "title": {"type": "string", "minLength": 1},
        "required_for_stable_release": {"type": "boolean"},
        "verdict": {"enum": ["pass", "blocked", "fail", "insufficient", "open"]},
        "evidence_strength": {"type": "string", "minLength": 1},
        "can_close": {"type": "boolean"},
        "owner_prs": {"type": "array", "items": {"type": "integer"}},
        "evidence_paths": {"type": "array", "items": {"type": "string"}},
        "blockers": {"type": "array", "items": {"type": "string"}},
        "issues": {"type": "array", "items": {"type": "string"}}
      }
    }
  }
}
