{
  "aggregate_verdict": "blocked",
  "blocking_required_gates": [
    {
      "blockers": [
        "The published current-base macos-hardware-compatibility-gate summaries for Mac16,8 readiness are blocked, not passing.",
        "The aggregate now requires at least one formal macOS Host compatibility row with verdict pass, a retained same-bundle gate_input artifact, required artifact roles, and repository_commit matching this manifest base before this gate can close.",
        "Read-only Screen Recording, Accessibility, and Microphone TCC rows are not proven for a stable signed Host whose csreq, TCC auth_reason, bundle id, install path, pinned signing leaf, canonical designated requirement, and source provenance satisfy the hardened current-source gate.",
        "Full macOS checks, packaged runtime launch, Protocol v1 stream, input smoke, and reconnect evidence are missing for that row.",
        "Intel Macs, additional Apple silicon models, macOS builds, and display topologies still require exact-row passing evidence before support claims."
      ],
      "can_close": false,
      "evidence_paths": [
        "README.md",
        "docs/testing.md",
        "docs/runbook/macos-host.md",
        "docs/runbook/macos-host-compatibility.md",
        "scripts/macos_dev_host.py",
        "scripts/verify_macos_host_cli_contract.swift",
        "scripts/verify_macos_permission_prompt_contract.swift",
        "docs/changes/2026-08-21-host-signing-tcc-preflight/evidence/2026-08-24-current-base-owner-blocked/macos-hardware-compatibility-gate.json",
        "docs/changes/2026-08-21-host-signing-tcc-preflight/evidence/2026-08-27-macos-host-compatibility-readiness-blocked/macos-hardware-compatibility-gate.json",
        "docs/changes/2026-08-21-host-signing-tcc-preflight/evidence/2026-08-27-macos-host-compatibility-readiness-blocked/README.md",
        "docs/changes/2026-08-21-host-signing-tcc-preflight/evidence/2026-08-29-macos-host-compatibility-current-base-blocked/macos-hardware-compatibility-gate.json",
        "docs/changes/2026-08-21-host-signing-tcc-preflight/evidence/2026-08-29-macos-host-compatibility-current-base-blocked/README.md",
        "docs/changes/2026-08-21-host-signing-tcc-preflight/evidence/2026-08-30-macos-host-compatibility-current-base-blocked/macos-hardware-compatibility-gate.json",
        "docs/changes/2026-08-21-host-signing-tcc-preflight/evidence/2026-08-30-macos-host-compatibility-current-base-blocked/README.md",
        "docs/changes/2026-08-21-host-signing-tcc-preflight/evidence/2026-08-31-macos-host-compatibility-current-base-blocked/macos-hardware-compatibility-gate.json",
        "docs/changes/2026-08-21-host-signing-tcc-preflight/evidence/2026-08-31-macos-host-compatibility-current-base-blocked/README.md",
        "docs/changes/2026-08-21-host-signing-tcc-preflight/evidence/2026-08-31-macos-host-compatibility-current-base-codex-task-blocked/macos-hardware-compatibility-gate.json",
        "docs/changes/2026-08-21-host-signing-tcc-preflight/evidence/2026-08-31-macos-host-compatibility-current-base-codex-task-blocked/README.md",
        "tools/vibescreen_evidence/macos_hardware_compatibility.py",
        "tools/vibescreen_evidence/phase0_stable_release.py"
      ],
      "evidence_strength": "readiness",
      "id": "macos_host_hardware_compatibility_matrix",
      "issues": [],
      "owner_prs": [],
      "required_for_stable_release": true,
      "title": "macOS Host hardware compatibility matrix",
      "verdict": "open"
    },
    {
      "blockers": [
        "PR #557 adds Android stream telemetry counters for dropped frames, decoder latency, session epoch, wire mode, and heartbeat source with focused JVM coverage, but these counters are diagnostic/source readiness only. PR #656, PR #671, and PR #701 further harden the formal latency/telemetry archive validators so malformed, insufficient, non-revalidating, or textually non-closing latency packages fail closed; this is evidence-tool hardening only. PR #706 hardens Host RSS readiness safety checks only, PR #707 clarifies macOS compatibility TCC documentation/source-guard behavior only, and neither adds external latency closure evidence.",
        "The tightened current-base latency gate remains blocked readiness; no external-camera latency sample package, raw camera media, annotated sample set, or synchronized-clock physical-input proof exists for the Phase 0 evidence archive."
      ],
      "can_close": false,
      "evidence_paths": [
        "docs/changes/2026-08-04-phase-0-baseline/TEST.md",
        "docs/changes/2026-08-04-phase-0-baseline/evidence/2026-08-27-nubia-p0110-latency-current-base-blocked/latency-preflight.json",
        "docs/changes/2026-08-04-phase-0-baseline/evidence/2026-08-28-nubia-p0110-latency-current-base-blocked/README.md",
        "docs/changes/2026-08-04-phase-0-baseline/evidence/2026-08-28-nubia-p0110-latency-current-base-blocked/latency-preflight.json",
        "docs/changes/2026-08-30-external-latency-owner/README.md",
        "docs/changes/2026-08-30-external-latency-owner/evidence/2026-08-30-current-base-blocked/README.md",
        "baseline/AndroidClient/app/src/main/java/dev/telemachus/display/DecoderTelemetrySnapshot.kt",
        "baseline/AndroidClient/app/src/main/java/dev/telemachus/display/HeartbeatTelemetryReporter.kt",
        "baseline/AndroidClient/app/src/test/java/dev/telemachus/display/DecoderTelemetryAccumulatorTest.kt",
        "baseline/AndroidClient/app/src/test/java/dev/telemachus/display/HeartbeatTelemetryReporterTest.kt",
        "tools/vibescreen_evidence/latency_artifact_text.py",
        "tools/vibescreen_evidence/latency_evidence.py",
        "tools/vibescreen_evidence/latency_manifest.py"
      ],
      "evidence_strength": "partial",
      "id": "telemetry_and_latency_archive",
      "issues": [],
      "owner_prs": [],
      "required_for_stable_release": true,
      "title": "Telemetry and external latency artifact archive",
      "verdict": "insufficient"
    },
    {
      "blockers": [
        "The retained two-hour Xiaomi 13 stream was stable but Host RSS grew about 18.3 MB with a positive second-half slope.",
        "No current-source host_rss_gate pass exists.",
        "The latest current-base readiness records are blocked before a stable-signed, read-only TCC-proven, listener-observed current-source Host can be launched with native VIBE_SCREEN_TELEMETRY_PATH coverage and a USB/LAN stream window.",
        "PR #706 hardens Host RSS readiness safety metadata validation so readiness packages that install or replace the Host, claim to close runtime gates, or omit required structured source paths fail closed; PR #707 only clarifies macOS compatibility TCC documentation/source-guard behavior. These changes do not provide a current-source two-hour no-growth pass."
      ],
      "can_close": false,
      "evidence_paths": [
        "docs/changes/2026-08-10-host-rss-growth/TECH.md",
        "docs/changes/2026-08-04-phase-0-baseline/evidence/2026-08-09-xiaomi-fuxi-soak2h-v2/README.md",
        "docs/changes/2026-08-10-host-rss-growth/evidence/2026-08-27-host-rss-short-window-readiness-blocked/README.md",
        "docs/changes/2026-08-10-host-rss-growth/evidence/2026-08-27-current-base-build-fix-readiness-blocked/README.md",
        "docs/changes/2026-08-10-host-rss-growth/evidence/2026-08-28-current-base-host-rss-failclosed-readiness/README.md",
        "docs/changes/2026-08-10-host-rss-growth/evidence/2026-08-29-current-base-host-rss-failclosed-readiness/README.md",
        "docs/changes/2026-08-10-host-rss-growth/evidence/2026-08-30-current-base-host-rss-failclosed-readiness/README.md",
        "docs/changes/2026-08-10-host-rss-growth/evidence/2026-08-31-current-base-host-rss-failclosed-readiness/README.md",
        "tools/vibescreen_evidence/host_rss_gate.py",
        "tools/tests/test_host_rss_gate.py"
      ],
      "evidence_strength": "historical-fail",
      "id": "host_rss_2h_no_growth",
      "issues": [],
      "owner_prs": [],
      "required_for_stable_release": true,
      "title": "Host RSS two-hour no-growth gate",
      "verdict": "blocked"
    },
    {
      "blockers": [
        "No physical Android mouse, touchpad, or trackball was attached during a Protocol v1 run.",
        "PR #558 adds Android native pointer hover enter/exit mapping and fail-closed unsupported-button filtering with focused JVM coverage, but this is source/unit readiness only.",
        "The latest current-base native-pointer HID summaries remain blocked and do not retain Android forwarding logs, Host pointer-injection logs, and visible Mac move/click result from the same observation window."
      ],
      "can_close": false,
      "evidence_paths": [
        "docs/testing.md",
        "docs/changes/2026-08-05-phase-1-android-client/evidence/2026-08-31-p0110-native-pointer-hid-current-base-blocked/README.md",
        "docs/changes/2026-08-05-phase-1-android-client/evidence/2026-08-31-p0110-native-pointer-hid-current-base-blocked/native-pointer-hid-summary.json",
        "baseline/AndroidClient/app/src/main/java/dev/telemachus/display/NativeInputWire.kt",
        "baseline/AndroidClient/app/src/test/java/dev/telemachus/display/NativeInputWireTest.kt",
        "baseline/AndroidClient/app/src/test/java/dev/telemachus/display/NativeInputSessionStateTest.kt",
        "baseline/AndroidClient/app/src/test/java/dev/telemachus/display/ClientInputDispatchTest.kt",
        "baseline/AndroidClient/app/src/test/java/dev/telemachus/display/StreamInputDispatcherTest.kt"
      ],
      "evidence_strength": "readiness",
      "id": "native_pointer_hid_mouse",
      "issues": [],
      "owner_prs": [],
      "required_for_stable_release": true,
      "title": "Native pointer HID mouse move/click acceptance",
      "verdict": "blocked"
    },
    {
      "blockers": [
        "No physical Android controller runtime run is recorded.",